{"$id":"https://orbital-dynamics.local/schemas/proposed_contact.v1.schema.json","$schema":"https://json-schema.org/draft/2020-12/schema","additionalProperties":true,"properties":{"cadence_import":{"additionalProperties":true,"properties":{"activity_type":{"type":"string"},"external_id":{"pattern":"^[A-Za-z0-9][A-Za-z0-9._:@-]*$","type":"string"},"schema_contract":{"const":"proposed_contact.v1","type":"string"}},"required":["external_id","activity_type"],"type":"object"},"direction":{"enum":["downlink","uplink","command","tracking"],"type":"string"},"ends_at_s":{"type":"number"},"estimated_throughput_mb":{"type":"number"},"ground_station_id":{"pattern":"^[A-Za-z0-9][A-Za-z0-9._:@-]*$","type":"string"},"id":{"pattern":"^[A-Za-z0-9][A-Za-z0-9._:@-]*$","type":"string"},"model_limits":{"items":{"enum":["artifact_level_only","no_provider_reservation","no_schedule_mutation"],"type":"string"},"type":"array"},"scenario_id":{"pattern":"^[A-Za-z0-9][A-Za-z0-9._:@-]*$","type":"string"},"schedule_conflict_status":{"type":"string"},"source_window":{"additionalProperties":true,"properties":{"confidence":{"type":"string"},"duration_s":{"type":"number"},"ends_at_s":{"type":"number"},"event_detector":{"type":"string"},"event_time_tolerance_s":{"type":"number"},"event_timing_policy":{"type":"string"},"ground_station_id":{"pattern":"^[A-Za-z0-9][A-Za-z0-9._:@-]*$","type":"string"},"id":{"pattern":"^[A-Za-z0-9][A-Za-z0-9._:@-]*$","type":"string"},"max_elevation_deg":{"type":"number"},"max_sample_step_s":{"type":"number"},"minimum_elevation_deg":{"type":"number"},"scenario_id":{"pattern":"^[A-Za-z0-9][A-Za-z0-9._:@-]*$","type":"string"},"starts_at_s":{"type":"number"},"target_id":{"pattern":"^[A-Za-z0-9][A-Za-z0-9._:@-]*$","type":"string"},"type":{"type":"string"}},"type":"object"},"source_window_id":{"pattern":"^[A-Za-z0-9][A-Za-z0-9._:@-]*$","type":"string"},"starts_at_s":{"type":"number"},"station_availability":{"type":"string"},"timeline_id":{"pattern":"^[A-Za-z0-9][A-Za-z0-9._:@-]*$","type":"string"},"timeline_identity":{"additionalProperties":true,"properties":{"activity_id":{"pattern":"^[A-Za-z0-9][A-Za-z0-9._:@-]*$","type":"string"},"activity_type":{"type":"string"},"scenario_id":{"pattern":"^[A-Za-z0-9][A-Za-z0-9._:@-]*$","type":"string"},"source_window_id":{"pattern":"^[A-Za-z0-9][A-Za-z0-9._:@-]*$","type":"string"},"subject_id":{"type":"string"},"timeline_id":{"pattern":"^[A-Za-z0-9][A-Za-z0-9._:@-]*$","type":"string"}},"type":"object"},"type":{"type":"string"}},"required":["id","type","scenario_id","ground_station_id","starts_at_s","ends_at_s","direction","estimated_throughput_mb","source_window","cadence_import"],"title":"OrbitalDynamics proposed_contact.v1","type":"object","x-orbital-dynamics":{"artifact_family":"proposed_contact","compatibility_policy":{"breaking_change_action":"mint a new schema_contract name or increment the artifact schema_version before publishing","breaking_changes":["remove_required_fields","change_required_field_type","change_schema_contract_identifier","change_schema_version_const","change_required_field_semantics"],"compatible_changes":["add_optional_fields","add_optional_nested_contracts","tighten_executable_semantic_validation_without_changing_exported_required_fields"],"policy_version":1,"validation_mode":"top_level_compatibility_export"},"compatibility_policy_version":1,"executable_contract":true,"identity_policy":{"breaking_changes":["change_existing_public_identifier_for_the_same_semantic_entity","emit_blank_identifier","emit_identifier_with_whitespace"],"compatible_changes":["add_optional_identifier_fields","add_more_specific_semantic_source_metadata_without_changing_existing_ids"],"description":"Public artifact identifiers are non-empty machine identifiers without whitespace.","generated_id_scopes":[{"identity_fields":["scenario_id","type","source_window_id","target_id","ground_station_id"],"ordering":["result_event_type","scenario_id","source_window_id","starts_at_s"],"scope":"candidate_refresh.v1.candidate_activities"},{"identity_fields":["spacecraft_id","scenario_id","epoch.seconds_since_j2000"],"ordering":["spacecraft_id","scenario_id","epoch.seconds_since_j2000"],"scope":"accepted_planning_state.v1.spacecraft_states"}],"policy_version":1,"semantic_invariants":["source_record_order_must_not_change_generated_identity","semantic_source_identity_must_remain_stable_across_manifest_export","scenario_and_activity_identity_must_not_depend_on_wall_clock_time"],"stable_id_pattern":"^[A-Za-z0-9][A-Za-z0-9._:@-]*$"},"identity_policy_version":1,"nested_contract_definition_scope":"direct_declared_contracts","nested_contracts":[],"schema_contract":"proposed_contact.v1","schema_version":1,"validation_mode":"top_level_compatibility_export"}}
