{
  "cadence_import": {
    "activity_type": "contact",
    "external_id": "leo_1_downlink_equator_prime_1",
    "schema_contract": "proposed_contact.v1"
  },
  "direction": "downlink",
  "ends_at_s": 345.1793094813298,
  "estimated_throughput_mb": 690.3586189626596,
  "ground_station_id": "equator_prime",
  "id": "leo_1_downlink_equator_prime_1",
  "model_limits": [
    "artifact_level_only",
    "no_provider_reservation",
    "no_schedule_mutation"
  ],
  "scenario_id": "leo_1",
  "schedule_conflict_status": "not_evaluated",
  "source_window": {
    "confidence": "bounded_by_sample_cadence",
    "event_detector": "access_windows",
    "event_time_tolerance_s": 60.0,
    "event_timing_policy": "sampled_state_linear_boundary",
    "id": "window:leo_1:ground_station_access:equator_prime:1",
    "max_elevation_deg": 90.0,
    "max_sample_step_s": 60.0,
    "minimum_elevation_deg": 5.0,
    "type": "ground_station_access"
  },
  "source_window_id": "window:leo_1:ground_station_access:equator_prime:1",
  "starts_at_s": 0.0,
  "station_availability": "available",
  "timeline_id": "timeline:leo_1:downlink:equator_prime:window:leo_1:ground_station_access:equator_prime:1",
  "timeline_identity": {
    "activity_id": "leo_1_downlink_equator_prime_1",
    "activity_type": "downlink",
    "scenario_id": "leo_1",
    "source_window_id": "window:leo_1:ground_station_access:equator_prime:1",
    "subject_id": "equator_prime",
    "timeline_id": "timeline:leo_1:downlink:equator_prime:window:leo_1:ground_station_access:equator_prime:1"
  },
  "type": "downlink"
}
